mysql> desc employee;
+-------------+---------------+------+-----+---------+-------+
| Field       | Type          | Null | Key | Default | Extra |
+-------------+---------------+------+-----+---------+-------+
| emp_id      | int           | NO   | PRI | NULL    |       |
| emp_name    | varchar(100)  | YES  |     | NULL    |       |
| designation | varchar(100)  | YES  |     | NULL    |       |
| salary      | decimal(10,2) | YES  |     | NULL    |       |
| manager_id  | int           | YES  |     | NULL    |       |
| project_id  | int           | YES  | MUL | NULL    |       |
+-------------+---------------+------+-----+---------+-------+
6 rows in set (0.01 sec)

mysql> desc Project;
+--------------+---------------+------+-----+---------+-------+
| Field        | Type          | Null | Key | Default | Extra |
+--------------+---------------+------+-----+---------+-------+
| project_id   | int           | NO   | PRI | NULL    |       |
| project_name | varchar(100)  | YES  |     | NULL    |       |
| location     | varchar(100)  | YES  |     | NULL    |       |
| budget       | decimal(12,2) | YES  |     | NULL    |       |
+--------------+---------------+------+-----+---------+-------+
4 rows in set (0.00 sec)

mysql> insert into Project values(101, 'Smart City Development', 'Pune', 50000000.00);
Query OK, 1 row affected (0.01 sec)

mysql> insert into Project values(102, 'E-Commerce Platform', 'Bangalore', 25000000.00),
    -> (103, 'AI Fire Detection System', 'Hyderabad', 18000000.00),
    -> (104, 'Banking Management System', 'Mumbai', 30000000.00);
Query OK, 3 rows affected (0.01 sec)
Records: 3  Duplicates: 0  Warnings: 0

mysql> insert into employee values(1, 'Amit Sharma', 'Project Manager', 120000.00, NULL, 101),
    -> (2, 'Neha Verma', 'Software Engineer', 70000.00, 1, 101),
    -> (3, 'Rahul Mehta', 'UI Developer', 65000.00, 1, 101),
    -> (4, 'Priya Singh', 'Project Manager', 115000.00, NULL, 102),
    -> (5, 'Karan Patel', 'Backend Developer', 80000.00, 4, 102),
    -> (6, 'Sneha Kulkarni', 'Frontend Developer', 75000.00, 4, 102),
    -> (7, 'Vikas Rao', 'ML Engineer', 90000.00, NULL, 103),
    -> (8, 'Anjali Deshmukh', 'Data Analyst', 72000.00, 7, 103),
    -> (9, 'Rohit Joshi', 'Project Manager', 110000.00, NULL, 104),
    -> (10, 'Pooja Nair', 'Java Developer', 78000.00, 9, 104);
Query OK, 10 rows affected (0.01 sec)
Records: 10  Duplicates: 0  Warnings: 0

mysql> select *from Project;
+------------+---------------------------+-----------+-------------+
| project_id | project_name              | location  | budget      |
+------------+---------------------------+-----------+-------------+
|        101 | Smart City Development    | Pune      | 50000000.00 |
|        102 | E-Commerce Platform       | Bangalore | 25000000.00 |
|        103 | AI Fire Detection System  | Hyderabad | 18000000.00 |
|        104 | Banking Management System | Mumbai    | 30000000.00 |
+------------+---------------------------+-----------+-------------+
4 rows in set (0.00 sec)

mysql> select *from employee;
+--------+-----------------+--------------------+-----------+------------+------------+
| emp_id | emp_name        | designation        | salary    | manager_id | project_id |
+--------+-----------------+--------------------+-----------+------------+------------+
|      1 | Amit Sharma     | Project Manager    | 120000.00 |       NULL |        101 |
|      2 | Neha Verma      | Software Engineer  |  70000.00 |          1 |        101 |
|      3 | Rahul Mehta     | UI Developer       |  65000.00 |          1 |        101 |
|      4 | Priya Singh     | Project Manager    | 115000.00 |       NULL |        102 |
|      5 | Karan Patel     | Backend Developer  |  80000.00 |          4 |        102 |
|      6 | Sneha Kulkarni  | Frontend Developer |  75000.00 |          4 |        102 |
|      7 | Vikas Rao       | ML Engineer        |  90000.00 |       NULL |        103 |
|      8 | Anjali Deshmukh | Data Analyst       |  72000.00 |          7 |        103 |
|      9 | Rohit Joshi     | Project Manager    | 110000.00 |       NULL |        104 |
|     10 | Pooja Nair      | Java Developer     |  78000.00 |          9 |        104 |
+--------+-----------------+--------------------+-----------+------------+------------+
10 rows in set (0.00 sec)

mysql> select e.emp_name,p.project_name,p.location,p.budget from Project p left join employee e on e.project_id=p.project_id;
+-----------------+---------------------------+-----------+-------------+
| emp_name        | project_name              | location  | budget      |
+-----------------+---------------------------+-----------+-------------+
| Amit Sharma     | Smart City Development    | Pune      | 50000000.00 |
| Neha Verma      | Smart City Development    | Pune      | 50000000.00 |
| Rahul Mehta     | Smart City Development    | Pune      | 50000000.00 |
| Priya Singh     | E-Commerce Platform       | Bangalore | 25000000.00 |
| Karan Patel     | E-Commerce Platform       | Bangalore | 25000000.00 |
| Sneha Kulkarni  | E-Commerce Platform       | Bangalore | 25000000.00 |
| Vikas Rao       | AI Fire Detection System  | Hyderabad | 18000000.00 |
| Anjali Deshmukh | AI Fire Detection System  | Hyderabad | 18000000.00 |
| Rohit Joshi     | Banking Management System | Mumbai    | 30000000.00 |
| Pooja Nair      | Banking Management System | Mumbai    | 30000000.00 |
+-----------------+---------------------------+-----------+-------------+
10 rows in set (0.00 sec)

mysql> insert into employee values(11,"saagar jadhav",null,"mumbai",9000900.00);
ERROR 1136 (21S01): Column count doesn't match value count at row 1
mysql> delete from employee where emp_id=11;
Query OK, 0 rows affected (0.01 sec)

mysql> insert into employee values(11,"tanvi jadhav","python developer",89000.0,Null,null);
Query OK, 1 row affected (0.00 sec)

mysql> select *from employee;
+--------+-----------------+--------------------+-----------+------------+------------+
| emp_id | emp_name        | designation        | salary    | manager_id | project_id |
+--------+-----------------+--------------------+-----------+------------+------------+
|      1 | Amit Sharma     | Project Manager    | 120000.00 |       NULL |        101 |
|      2 | Neha Verma      | Software Engineer  |  70000.00 |          1 |        101 |
|      3 | Rahul Mehta     | UI Developer       |  65000.00 |          1 |        101 |
|      4 | Priya Singh     | Project Manager    | 115000.00 |       NULL |        102 |
|      5 | Karan Patel     | Backend Developer  |  80000.00 |          4 |        102 |
|      6 | Sneha Kulkarni  | Frontend Developer |  75000.00 |          4 |        102 |
|      7 | Vikas Rao       | ML Engineer        |  90000.00 |       NULL |        103 |
|      8 | Anjali Deshmukh | Data Analyst       |  72000.00 |          7 |        103 |
|      9 | Rohit Joshi     | Project Manager    | 110000.00 |       NULL |        104 |
|     10 | Pooja Nair      | Java Developer     |  78000.00 |          9 |        104 |
|     11 | tanvi jadhav    | python developer   |  89000.00 |       NULL |       NULL |
+--------+-----------------+--------------------+-----------+------------+------------+
11 rows in set (0.00 sec)

mysql> select e.emp_name,e.designation,e.salary from employee e right join Project p on e.emp_id=p.emp_id;
ERROR 1054 (42S22): Unknown column 'p.emp_id' in 'on clause'
mysql> select e.emp_name,e.designation,e.salary from employee e right join Project p on e.project_id=p.project_id;
+-----------------+--------------------+-----------+
| emp_name        | designation        | salary    |
+-----------------+--------------------+-----------+
| Amit Sharma     | Project Manager    | 120000.00 |
| Neha Verma      | Software Engineer  |  70000.00 |
| Rahul Mehta     | UI Developer       |  65000.00 |
| Priya Singh     | Project Manager    | 115000.00 |
| Karan Patel     | Backend Developer  |  80000.00 |
| Sneha Kulkarni  | Frontend Developer |  75000.00 |
| Vikas Rao       | ML Engineer        |  90000.00 |
| Anjali Deshmukh | Data Analyst       |  72000.00 |
| Rohit Joshi     | Project Manager    | 110000.00 |
| Pooja Nair      | Java Developer     |  78000.00 |
+-----------------+--------------------+-----------+
10 rows in set (0.00 sec)

mysql> select e.emp_name,e.designation,e.salary from Project p right join employee e on e.project_id=p.project_id;
+-----------------+--------------------+-----------+
| emp_name        | designation        | salary    |
+-----------------+--------------------+-----------+
| Amit Sharma     | Project Manager    | 120000.00 |
| Neha Verma      | Software Engineer  |  70000.00 |
| Rahul Mehta     | UI Developer       |  65000.00 |
| Priya Singh     | Project Manager    | 115000.00 |
| Karan Patel     | Backend Developer  |  80000.00 |
| Sneha Kulkarni  | Frontend Developer |  75000.00 |
| Vikas Rao       | ML Engineer        |  90000.00 |
| Anjali Deshmukh | Data Analyst       |  72000.00 |
| Rohit Joshi     | Project Manager    | 110000.00 |
| Pooja Nair      | Java Developer     |  78000.00 |
| tanvi jadhav    | python developer   |  89000.00 |
+-----------------+--------------------+-----------+
11 rows in set (0.01 sec)

mysql>
mysql> select emp_id,emp_name,designation,salary
    -> from salary where project_id is null;
ERROR 1146 (42S02): Table 'j2025.salary' doesn't exist

mysql> select emp_id,emp_name,designation,salary
    -> from Project where project_id is null;
ERROR 1054 (42S22): Unknown column 'emp_id' in 'field list'
mysql> select emp_id,emp_name,designation,salary
    -> from employee where project_id is null;
+--------+--------------+------------------+----------+
| emp_id | emp_name     | designation      | salary   |
+--------+--------------+------------------+----------+
|     11 | tanvi jadhav | python developer | 89000.00 |
+--------+--------------+------------------+----------+
1 row in set (0.00 sec)

mysql> insert into employee values(12,"Ravwdi rathod","ML developer",87777.00,Null,null);
Query OK, 1 row affected (0.01 sec)


mysql> select count(*) from employee;
+----------+
| count(*) |
+----------+
|       12 |
+----------+
1 row in set (0.01 sec)

mysql> select e.emp_name,p.Project_name from employee e right join Project p;
ERROR 1064 (42000): You have an error in your SQL syntax; check the manual that corresponds to your MySQL server version for the right syntax to use near '' at line 1
mysql> select e.emp_name,p.Project_name from employee e right join Project p on e.project_id=p.project_id;
+-----------------+---------------------------+
| emp_name        | Project_name              |
+-----------------+---------------------------+
| Amit Sharma     | Smart City Development    |
| Neha Verma      | Smart City Development    |
| Rahul Mehta     | Smart City Development    |
| Priya Singh     | E-Commerce Platform       |
| Karan Patel     | E-Commerce Platform       |
| Sneha Kulkarni  | E-Commerce Platform       |
| Vikas Rao       | AI Fire Detection System  |
| Anjali Deshmukh | AI Fire Detection System  |
| Rohit Joshi     | Banking Management System |
| Pooja Nair      | Banking Management System |
+-----------------+---------------------------+
10 rows in set (0.00 sec)

mysql> select e.emp_name,p.Project_name from Project p right join employee e on e.project_id=p.project_id;
+-----------------+---------------------------+
| emp_name        | Project_name              |
+-----------------+---------------------------+
| Amit Sharma     | Smart City Development    |
| Neha Verma      | Smart City Development    |
| Rahul Mehta     | Smart City Development    |
| Priya Singh     | E-Commerce Platform       |
| Karan Patel     | E-Commerce Platform       |
| Sneha Kulkarni  | E-Commerce Platform       |
| Vikas Rao       | AI Fire Detection System  |
| Anjali Deshmukh | AI Fire Detection System  |
| Rohit Joshi     | Banking Management System |
| Pooja Nair      | Banking Management System |
| tanvi jadhav    | NULL                      |
| Ravwdi rathod   | NULL                      |
+-----------------+---------------------------+
12 rows in set (0.00 sec)

mysql> select e.emp_name,p.Project_name from Project p right join employee e on p.project_id=e.project_id;
+-----------------+---------------------------+
| emp_name        | Project_name              |
+-----------------+---------------------------+
| Amit Sharma     | Smart City Development    |
| Neha Verma      | Smart City Development    |
| Rahul Mehta     | Smart City Development    |
| Priya Singh     | E-Commerce Platform       |
| Karan Patel     | E-Commerce Platform       |
| Sneha Kulkarni  | E-Commerce Platform       |
| Vikas Rao       | AI Fire Detection System  |
| Anjali Deshmukh | AI Fire Detection System  |
| Rohit Joshi     | Banking Management System |
| Pooja Nair      | Banking Management System |
| tanvi jadhav    | NULL                      |
| Ravwdi rathod   | NULL                      |
+-----------------+---------------------------+
12 rows in set (0.00 sec)


mysql> select e.emp_name,p.manager_id from employee e inner join employee p on e.manager_id=p.manager_id;
+-----------------+------------+
| emp_name        | manager_id |
+-----------------+------------+
| Rahul Mehta     |          1 |
| Neha Verma      |          1 |
| Rahul Mehta     |          1 |
| Neha Verma      |          1 |
| Sneha Kulkarni  |          4 |
| Karan Patel     |          4 |
| Sneha Kulkarni  |          4 |
| Karan Patel     |          4 |
| Anjali Deshmukh |          7 |
| Pooja Nair      |          9 |
+-----------------+------------+
10 rows in set (0.00 sec)

mysql> select e.emp_name,p.manager_id from employee e inner join employee p on e.manager_id=p.emp_id;
+-----------------+------------+
| emp_name        | manager_id |
+-----------------+------------+
| Neha Verma      |       NULL |
| Rahul Mehta     |       NULL |
| Karan Patel     |       NULL |
| Sneha Kulkarni  |       NULL |
| Anjali Deshmukh |       NULL |
| Pooja Nair      |       NULL |
+-----------------+------------+
6 rows in set (0.00 sec)
